"18.972082138061523",,,"[B8LFD5, FAZ83_00065, FAZ83_00160, FAZ83_00345, FAZ83_00350, FAZ83_00360, FAZ83_00430, FAZ83_00680, FAZ83_00825, FAZ83_01055, FAZ83_01105, FAZ83_01125, FAZ83_01365, FAZ83_01505, FAZ83_01775, FAZ83_01830, FAZ83_02020, FAZ83_02075, FAZ83_02295, FAZ83_02350, FAZ83_02450, FAZ83_02820, FAZ83_03010, FAZ83_03350, FAZ83_03555, FAZ83_03905, FAZ83_04365, FAZ83_04470, FAZ83_04480, FAZ83_04835, FAZ83_05280, FAZ83_05390, FAZ83_05515, FAZ83_05550, FAZ83_05555, FAZ83_05605, FAZ83_05640, FAZ83_05685, FAZ83_05705, FAZ83_05745, FAZ83_06015, FAZ83_06475, FAZ83_06800, FAZ83_07525, FAZ83_07585, FAZ83_08200, FAZ83_08290, FAZ83_08405, FAZ83_08510, FAZ83_08530, FAZ83_08640, FAZ83_08645, FAZ83_08670, FAZ83_08695, FAZ83_08740, FAZ83_08745, FAZ83_08905, FAZ83_09320, FAZ83_09620, FAZ83_09720, FAZ83_10010, FAZ83_10055, FAZ83_10440, FAZ83_10685, FAZ83_10845, FAZ83_10930, FAZ83_10935, FAZ83_11140, FAZ83_11440, FAZ83_11460, FAZ83_11575, FAZ83_11580, FAZ83_11865, FAZ83_11940, FAZ83_11960, FAZ83_12675, FAZ83_12680, FAZ83_12970, FAZ83_13010, FAZ83_13135, FAZ83_13165, FAZ83_13290, FAZ83_13305, FAZ83_13360, FAZ83_13685, FAZ83_13725, FAZ83_13785, FAZ83_13900, FAZ83_14105, FAZ83_14490, FAZ83_14975, FAZ83_15230, FAZ83_15385, FAZ83_15415, FAZ83_15530, FAZ83_15545, FAZ83_15655, FAZ83_15700, FAZ83_15850, FAZ83_16020, FAZ83_16080, FAZ83_16260, FAZ83_17400, FAZ83_17470, FAZ83_17725, FAZ83_17745, FAZ83_17925, FAZ83_18270, FAZ83_18520, FAZ83_18525, FAZ83_18885, FAZ83_19100, FAZ83_19105, FAZ83_19110, FAZ83_19145, FAZ83_19190, FAZ83_19455, FAZ83_19495, FAZ83_19575, FAZ83_20090, FAZ83_20250, FAZ83_20265, FAZ83_20300, FAZ83_20350, FAZ83_20355, FAZ83_20445, FAZ83_20885, FAZ83_21025, FAZ83_21150, FAZ83_21375, FAZ83_21875, FAZ83_21940, FAZ83_21960, FAZ83_21975, FAZ83_22410, FAZ83_23080, FAZ83_23105, FAZ83_23175, FAZ83_23345, FAZ83_23380, FAZ83_23440, FAZ83_23660, FAZ83_23880, FAZ83_24430, FAZ83_24910, FAZ83_24915, FAZ83_25015, FAZ83_25100, FAZ83_25380, FAZ83_25705, aaeR, abgR, accA, accC, accD, aceF, ackA, acnB, acrR, acs, ada, add, adiY, adk, aes, agaI, agaR, ahpC, aidB, alaS, allR, allS, alpA, alsK, amn, apaG, appY, apt, araC, arcA, arcA2, arcB, arfA, arfB, argG, argL, argP, argR, argS, arnA, arsR, ascG, asnA, asnB, asnC, asnS, aspS, atoC, atoS, atpA, atpB, atpC, atpD, atpE, atpF, atpG, atpH, baeR, basR, baxL, bdcR, betA, betB, betI, betT, bglG, bglJ, bioA, bioB, bioC, bioD, bioD1, bioD2, bioF, bioH, birA, bluF, bluR, bolA, btsR, btuR, cadC, caiF, carA, carB, cbl, cdaR, cecR, chbR, cmk, cnu, coaA, coaBC, coaD, coaE, cobA, cobC, cobO, cobS, cobT, cobU, cof, comR, cpsB, cpxR, cra, creB, crl, crp, csgD, csiE, csiR, cspA, cspB, cspC, cspD, cspE, cspF, cspG, cspH, cspI, csqR, csrA, cueR, cusR, cyaA, cydC, cynR, cyoE, cysB, cysG, cysS, cytR, dcd, dctR, dcuA, dcuR, dcuS, deaD, decR, def, deoR, dfrA24, dgcM, dgoR, dhaR, dhbA, dicA, dinB, dinJ, dmlR, dnaB, dnaC, dnaE, dnaG, dnaJ, dnaK, dnaN, dnaQ, dnaT, dnaX, dpiA, dpiB, dsdC, dut, dxs, ebgR, ecpR, efp, eilA, emrR, entA, entB, entC, entD, entE, entF, entH, envR, envY, epd, epmA, ettA, eutR, eutT, evgA, exuR, fabG, fabI, fabR, fabY, fadR, fcl, feaB, feaR, fecI, fecR, fhlA, fimZ, fis, flgM, flhC, flhD, fliA, fliI, fliZ, fmt, fnr, folA, folB, folC, folD, folE, folK, folP, frlR, frmR, frr, ftsK, fucR, fur, fusA, gadE, gadW, gadX, galR, galS, gatR, gcvA, gcvR, ggt, glaR, glcC, glmM, glmS, glmU, glnG, glnL, glnS, glpR, glrR, gltX, gluQ, gluQRS, glyQ, glyS, gmd, gmhB, gmk, gntR, gppA, gpt, greA, greB, grxA, grxC, gshA, gshB, gsk, guaA, guaB, gutM, gyrA, gyrB, hcaR, hdfR, hemA, hemB, hemC, hemD, hemE, hemF, hemG, hemH, hemL, hemN, hemW, hemY, hexR, hflX, hfq, higA, higB, hipA, hipB, hisA, hisS, hldD, hldE, hns, holA, holB, holC, holD, holE, hpf, hprR, hpt, hupA, hupB, hyfR, hypT, iclR, idlP, idnR, ihfA, ihfB, ileS, ilvL, ilvY, infA, infB, infC, insC7, insH5, iraD, iraM, iraP, iscR, kdgR, kdpE, kdsB, lacI, lepA, leuO, leuS, lexA, lgoR, lit, lldR, lrhA, lrp, lsrR, lysP, lysR, lysS, lysU, malI, malT, malY, manA, manB, manC, marA, marR, matP, mazF, mcbR, melR, metF, metG, metJ, metR, mfd, mgtL, mhpR, miaA, mlc, mlrA, mngR, mntR, mobA, mocA, modE, mprA, mqsA, mqsR, mraZ, mtfA, mtlR, murA, murR, nac, nadA, nadB, nadC, nadD, nadE, nadK, nadR, nagB, nagC, nanR, narL, narP, ndk, nemR, nhaR, nikR, nimR, norR, nrdA, nrdB, nrdD, nrdE, nrdF, nrdR, nsrR, ntrB, ntrC, nudB, nusA, nusB, nusG, ompR, oxyR, paaX, pabA, pabB, pabC, panB, panC, panD, panE, panM, panZ, pdeL, pdhR, pdxA, pdxB, pdxH, pdxJ, pdxK, pdxY, pepA, perR, pgrR, pheM, pheS, pheT, phnF, phnN, phoB, phoP, phoR, pncA, pncB, pncC, polA, polB, prfA, prfB, prfC, prfH, priA, priB, priC, prlF, prmC, proS, prpR, prs, pspA, pspB, pspF, pta, pth, purA, purB, purC, purD, purE, purF, purH, purK, purL, purM, purN, purR, purT, purU, putA, puuR, pyrB, pyrC, pyrD, pyrE, pyrF, pyrG, pyrH, pyrI, pyrL, qseB, queA, queC, queD, queE, queF, queG, queH, quuD, quuQ, racR, radD, raiA, rapA, ratA, rbbA, rbsR, rcdA, rclR, rcnR, rcsA, rcsB, rcsC, recF, recR, relA, relB, relE, repB, repE, rfaD, rfaH, rfbA, rfbB, rfbC, rfbD, rhaR, rhaS, rhmR, rho, rhoL, ribA, ribB, ribC, ribD, ribE, ribF, rimK, rimP, rmf, rnk, rob, robA, rof, rpiR, rplA, rplB, rplC, rplD, rplE, rplF, rplI, rplJ, rplK, rplL, rplM, rplN, rplO, rplP, rplQ, rplR, rplS, rplT, rplU, rplV, rplW, rplX, rplY, rpmA, rpmB, rpmC, rpmD, rpmE, rpmE2, rpmF, rpmG, rpmH, rpmI, rpmJ, rpoA, rpoB, rpoC, rpoD, rpoE, rpoH, rpoN, rpoS, rpoZ, rpsA, rpsB, rpsC, rpsD, rpsE, rpsF, rpsG, rpsH, rpsI, rpsJ, rpsK, rpsL, rpsM, rpsN, rpsO, rpsP, rpsQ, rpsR, rpsS, rpsT, rpsU, rsd, rseA, rseD, rseP, rsfS, rsmB, rspR, rssB, rstA, rtcR, rutR, sdiA, secM, selA, selB, seqA, serC, serS, sfsA, sgbH, sgcR, sgrR, slmA, slyA, smpB, soxR, soxS, speA, speB, speC, speD, speE, speF, speFL, spoT, sra, srlR, sspA, stpA, suhB, sul1, sutR, sxy, tdcA, tdcR, tdk, tgt, thiC, thiD, thiE, thiF, thiG, thiH, thiI, thiK, thiL, thiM, thiS, thrL, thrS, thyA, tmk, tnaC, torI, torR, torT, traJ, treR, trpA, trpB, trpC, trpCF, trpD, trpE, trpGD, trpL, trpR, trpS, trxA, tsf, ttdR, tufA, tufB, tyrR, tyrS, uacR, udk, udp, ugd, uhpA, uidR, ulaD, ulaR, umuC, umuD, uof, upp, uspG, uvrY, uxuR, valS, xapR, xdhA, xdhB, xdhC, xdhD, xylR, xynR, yacG, yafC, yafN, yafO, yafQ, yahB, ybaK, ybcJ, ybcM, ybdO, ybdZ, ybeF, ybeY, ybfE, ybfI, ybhD, ybiA, ybiB, ybjD, ybjI, ybtA, ycaN, ycgZ, yciH, yciT, ycjW, ydcI, ydcR, ydeO, ydhB, ydiP, ydiV, ydjF, yeaK, yebC, yeeN, yeeY, yefM, yegW, yeiE, yeiL, yeiP, yfbR, yfdG, yfeR, yfhH, yfiE, yfjR, ygaV, ygbI, ygcP, ygeH, ygeK, ygfA, ygfI, ygiV, ygjP, yhaJ, yhfY, yhgF, yhhQ, yhjB, yhjC, yiaJ, yiaU, yidL, yidP, yidZ, yieK, yieP, yigB, yigZ, yihL, yiiE, yiiF, yijO, yjdC, yjhI, yjiE, yjiR, yjjG, yjjQ, ykgA, ykgM, ykgO, yneJ, yneL, ynfL, yoeB, ypdB, ypdC, yqeH, yqeI, yqhC, yqjI, yuaB, yuaK, yubQ, zntR, zraR, zur]","[accD, aceF, ackA, acnB, acs, adk, ahpC, allR, alsK, amn, apt, arcA, arcB, argG, argP, asnB, asnS, aspS, atpA, atpC, atpD, atpF, atpG, atpH, baeR, bioA, bioD1, carA, carB, cmk, coaA, coaBC, coaE, cobC, cpxR, crl, crp, cspC, cspE, cspI, csrA, cyaA, cysB, dcd, dcuS, def, deoR, dgoR, dnaJ, dnaK, dnaN, dut, entC, entE, entF, epd, ettA, evgA, fabG, fabI, fabY, fadR, fecR, fnr, folA, folE, folP, frr, ftsK, fur, fusA, gcvR, glmM, glmS, glpR, gltX, glyS, gmk, gntR, gpt, greA, grxC, gshA, guaA, guaB, gyrA, hemB, hemC, hemF, hemG, hemY, hexR, hflX, hfq, hipA, hisS, hldD, hldE, hns, hpt, hupA, hupB, ihfA, ihfB, infA, infB, infC, kdgR, lacI, lepA, leuS, lrhA, lrp, lysU, matP, metF, mhpR, mlc, modE, mprA, mtfA, murA, nadC, nadE, nadR, nagB, nagC, narL, nikR, nrdA, nrdE, nrdR, nusA, ompR, oxyR, panC, panZ, pdhR, pdxA, pdxB, pdxH, pdxJ, pdxK, pdxY, pepA, pheS, pheT, phoB, phoP, pncB, polA, prfA, prfB, prfC, prlF, proS, prs, pspA, pspB, pta, pth, purC, purE, purH, purM, purT, purU, pyrB, pyrC, pyrG, pyrH, pyrI, queC, queE, queF, raiA, rapA, rcsB, recF, relA, rfbA, rfbB, rho, ribA, ribC, ribD, ribF, rmf, rnk, rof, rplB, rplC, rplD, rplE, rplF, rplI, rplJ, rplK, rplL, rplM, rplN, rplO, rplP, rplQ, rplS, rplT, rplU, rplV, rplW, rplY, rpmA, rpmB, rpmC, rpmD, rpmE, rpmF, rpoA, rpoB, rpoC, rpoD, rpoE, rpoH, rpsA, rpsB, rpsC, rpsD, rpsE, rpsF, rpsG, rpsH, rpsI, rpsJ, rpsK, rpsL, rpsM, rpsN, rpsO, rpsP, rpsQ, rpsR, rpsS, rpsT, rsmB, rstA, selA, seqA, serS, smpB, speA, speB, speD, speE, spoT, sra, sspA, stpA, suhB, thiD, thiF, thiG, thiI, thiK, thrS, treR, trpA, trpB, trpC, trpGD, trpR, trpS, trxA, tsf, tyrR, tyrS, uacR, udk, upp, uspG, valS, xynR, ybaK, ybeY, ybjD, ybjI, yciH, yciT, ydcI, yebC, yeiE, yeiP, yfbR, yhgF, yigB, yjdC, yjiR, ykgM, yneJ, yqjI, zur]",,,,,,,,,"[Group14, Group16]","[4]","{Group14=1.9697693126353342E-19, Group16=6.427747381108677E-28}","{Group14=2.1667462438988677E-18, Group16=9.641621071663015E-27}","GO:0044271",,"cellular%20nitrogen%20compound%20biosynthetic%20process","299","GO_BiologicalProcess-Custom-GOA-ACAP-ARAP_04.11.2021_00h00","FALSE","false","cellular%20nitrogen%20compound%20biosynthetic%20process","cellular nitrogen compound biosynthetic process","8.838284823533909E-16","6.487301060473889E-13",,"GO:0044271"
"23.051408767700195",,,"[FAZ83_00715, FAZ83_05260, FAZ83_05975, FAZ83_06060, FAZ83_06800, FAZ83_08655, FAZ83_08675, FAZ83_09900, FAZ83_10010, FAZ83_10685, FAZ83_12635, FAZ83_13125, FAZ83_14160, FAZ83_17400, FAZ83_17450, FAZ83_18160, FAZ83_19990, FAZ83_20520, FAZ83_21025, FAZ83_21370, FAZ83_21375, FAZ83_21865, accA, accB, accC, accD, ackA, acpH, acpP, acpS, acpT, add, adhE, alaA, alaC, alr, apt, argA, argB, argC, argD, argE, argF, argG, argH, argI, argR, aroA, aroB, aroC, aroD, aroE, aroF, aroG, aroH, aroK, aroL, asd, asnA, asnB, aspC, astC, avtA, bioA, bioB, bioC, bioD, bioD1, bioD2, bioF, bioH, birA, btuR, carA, carB, cbl, cfa, cobA, cobC, cobO, cobS, cobT, cobU, cof, cysB, cysE, cysG, cysI, cysJ, cysK, cysM, cysZ, dadX, dapA, dapB, dapD, dapE, dapF, dfrA24, dkgA, dkgB, dmpG, dxs, epd, eutT, fabA, fabB, fabD, fabF, fabG, fabH, fabI, fabR, fabY, fabZ, fadR, fbaA, fbp, folA, folB, folC, folD, folE, folK, folP, fre, gabT, gcl, gdhA, ggt, glnA, glnB, glpX, glsA1, glsA2, gltB, gltD, glyA, gph, gpmA, gutQ, hchA, hemD, hemE, hisA, hisB, hisC, hisD, hisF, hisG, hisH, hisI, hisL, ilvA, ilvB, ilvC, ilvD, ilvE, ilvG, ilvH, ilvI, ilvL, ilvM, ilvN, ilvY, insC7, irp1, ispB, ispF, ispU, ivbL, kdsA, kdsB, kdsD, leuA, leuB, leuC, leuD, leuL, lipA, lipB, lpxL, lpxM, lpxP, ltaE, luxS, lysA, lysC, lysR, maeA, malY, menA, menB, menC, menD, menE, menF, menH, menI, metA, metAS, metB, metC, metE, metF, metH, metJ, metL, metR, mgsA, mhpE, mhpF, mmuM, mmuP, msbB, mtnA, mtnN, nadA, nudB, pabA, pabB, pabC, panB, panC, panD, panE, panM, panZ, pckA, pdxA, pdxB, pdxH, pdxJ, pdxK, pdxY, pgi, pgk, pheA, plsX, ppsA, proA, proB, proC, pta, purA, purC, purU, putA, puuA, pyrE, queA, queC, queD, queE, queF, queG, queH, rarA, ribA, ribB, ribC, ribD, ribE, ribF, ridA, sdaA, sdaB, selA, selD, serA, serB, serC, serS, speD, sul1, tdcG, tdh, tgt, thiC, thiD, thiE, thiF, thiG, thiH, thiI, thiK, thiL, thiM, thiS, thrA, thrB, thrC, thrL, tpiA, trpA, trpB, trpC, trpCF, trpD, trpE, trpGD, trpL, tyrA, tyrB, ubiA, ubiB, ubiC, ubiD, ubiE, ubiF, ubiG, ubiH, ubiI, ubiJ, ubiK, ubiT, ubiU, ubiV, ubiX, ugd, usg, waaA, wcaB, xdhA, xdhB, xdhC, xdhD, yajL, ybiA, ybiB, ybjI, ydfG, ydiB, ydiO, yedP, ygeW, ygfK, yggF, yhbO, yheT, yhhQ, yieE, yigB, yqeF, yuaK]","[accB, accD, ackA, acpP, adhE, alaA, apt, argA, argC, argD, argG, aroB, aroD, aroF, aroG, aroH, aroK, aroL, asd, asnB, aspC, avtA, bioA, bioD1, carA, carB, cfa, cobC, cysB, cysI, cysJ, cysK, cysM, dapB, dapD, dapE, dkgA, dkgB, epd, fabA, fabD, fabF, fabG, fabH, fabI, fabY, fabZ, fadR, fbaA, fbp, folA, folE, folP, fre, gabT, gdhA, glnA, glnB, gltB, gltD, glyA, gph, gpmA, hisB, hisF, hisG, ilvA, ilvD, ilvH, ilvI, ispB, kdsA, leuA, leuB, ltaE, luxS, lysA, lysC, menB, menI, metB, metE, metF, metH, metL, mgsA, mhpE, mmuM, panC, panZ, pckA, pdxA, pdxB, pdxH, pdxJ, pdxK, pdxY, pgk, pheA, proA, proB, proC, pta, purC, purU, queC, queE, queF, ribA, ribC, ribD, ribF, selA, selD, serA, serB, serS, speD, thiD, thiF, thiG, thiI, thiK, thrA, thrB, thrC, tpiA, trpA, trpB, trpC, trpGD, tyrA, tyrB, ubiC, ubiE, ybjI, ydfG, yhbO, yigB]",,,,,,,,,"[Group12, Group14]","[3]","{Group12=1.016303116329265E-31, Group14=1.9697693126353342E-19}","{Group12=1.626084986126824E-30, Group14=2.1667462438988677E-18}","GO:0044283",,"small%20molecule%20biosynthetic%20process","139","GO_BiologicalProcess-Custom-GOA-ACAP-ARAP_04.11.2021_00h00","FALSE","false","small%20molecule%20biosynthetic%20process","small molecule biosynthetic process","1.8474807830558952E-13","1.3320336445833004E-10",,"GO:0044283"
"42.477874755859375",,,"[hpf, raiA, rbbA, rplA, rplB, rplC, rplD, rplE, rplF, rplI, rplJ, rplK, rplL, rplM, rplN, rplO, rplP, rplQ, rplR, rplS, rplT, rplU, rplV, rplW, rplX, rplY, rpmA, rpmB, rpmC, rpmD, rpmE, rpmF, rpmG, rpmI, rpmJ, rpsA, rpsB, rpsC, rpsD, rpsE, rpsF, rpsG, rpsH, rpsI, rpsJ, rpsK, rpsL, rpsM, rpsN, rpsO, rpsP, rpsQ, rpsR, rpsS, rpsT, rpsU, sra]","[raiA, rplB, rplC, rplD, rplE, rplF, rplI, rplJ, rplK, rplL, rplM, rplN, rplO, rplP, rplQ, rplS, rplT, rplU, rplV, rplW, rplY, rpmA, rpmB, rpmC, rpmD, rpmE, rpmF, rpsA, rpsB, rpsC, rpsD, rpsE, rpsF, rpsG, rpsH, rpsI, rpsJ, rpsK, rpsL, rpsM, rpsN, rpsO, rpsP, rpsQ, rpsR, rpsS, rpsT, sra]",,,,,,,,,"[Group16]","[3, 6]","{Group16=6.427747381108677E-28}","{Group16=9.641621071663015E-27}","GO:0044391",,"ribosomal%20subunit","48","GO_CellularComponent-Custom-GOA-ACAP-ARAP_04.11.2021_00h00","FALSE","false","ribosomal%20subunit","ribosomal subunit","2.0080907491256894E-15","1.4659062468617533E-12",,"GO:0044391"
"40.90909194946289",,,"[FAZ83_02015, FAZ83_02925, aceE, aceF, adk, eno, fbaA, fbaB, gapA, glk, gpmA, gpmB, gpmI, gpmM, lpdA, mdh, pfkA, pfkB, pgi, pgk, ppk, ppk1, pykA, pykF, tpiA]","[aceF, adk, eno, fbaA, fbaB, gapA, gpmA, gpmB, gpmI, lpdA, mdh, pfkA, pfkB, pgk, ppk, pykA, pykF, tpiA]",,,,,,,,,"[Group15]","[7, 8, 9, 10]","{Group15=4.724342098617546E-10}","{Group15=4.724342098617546E-9}","GO:0046031",,"ADP%20metabolic%20process","18","GO_BiologicalProcess-Custom-GOA-ACAP-ARAP_04.11.2021_00h00","FALSE","false","ADP%20metabolic%20process","ADP metabolic process","2.5510855333277407E-6","0.0016990229651962752",,"GO:0046031"
"31.538461685180664",,,"[FAZ83_00825, FAZ83_05685, FAZ83_06800, FAZ83_14490, FAZ83_19190, accA, accC, accD, aceF, ackA, acs, adk, amn, apt, atpA, atpB, atpC, atpD, atpE, atpF, atpG, atpH, carA, carB, coaA, coaBC, coaD, coaE, cyaA, deoB, fliI, gppA, gpt, gsk, guaA, guaB, hpt, ndk, phnN, prs, pta, purA, purB, purC, purD, purE, purF, purH, purK, purL, purM, purN, purT, purU, pyrB, pyrC, pyrD, pyrE, pyrF, pyrG, pyrH, relA, ribF, spoT, udk, udp, upp, ygjP]","[accD, aceF, ackA, acs, adk, amn, apt, atpA, atpC, atpD, atpF, atpG, atpH, carA, carB, coaA, coaBC, coaE, cyaA, deoB, gpt, guaA, guaB, hpt, prs, pta, purC, purE, purH, purM, purT, purU, pyrB, pyrC, pyrG, pyrH, relA, ribF, spoT, udk, upp]",,,,,,,,,"[Group15]","[5, 6]","{Group15=4.724342098617546E-10}","{Group15=4.724342098617546E-9}","GO:0046390",,"ribose%20phosphate%20biosynthetic%20process","41","GO_BiologicalProcess-Custom-GOA-ACAP-ARAP_04.11.2021_00h00","FALSE","false","ribose%20phosphate%20biosynthetic%20process","ribose phosphate biosynthetic process","1.2202136260256173E-8","8.456080428357528E-6",,"GO:0046390"
"24.75247573852539",,,"[FAZ83_00715, FAZ83_05975, FAZ83_08655, FAZ83_08675, FAZ83_09900, FAZ83_12635, FAZ83_13125, FAZ83_14160, FAZ83_17400, FAZ83_17450, FAZ83_19990, FAZ83_20520, FAZ83_21025, FAZ83_21370, FAZ83_21375, FAZ83_21865, accA, accB, accC, accD, ackA, acpH, acpP, acpS, acpT, alaA, alaC, alr, argA, argB, argC, argD, argE, argF, argG, argH, argI, argR, aroA, aroB, aroC, aroD, aroE, aroF, aroG, aroH, aroK, aroL, asd, asnA, asnB, aspC, astC, avtA, bioA, bioB, bioC, bioD, bioD1, bioD2, bioF, bioH, birA, carA, carB, cbl, cfa, cysB, cysE, cysI, cysJ, cysK, cysM, cysZ, dadX, dapA, dapB, dapD, dapE, dapF, dfrA24, dkgA, dkgB, dmpG, fabA, fabB, fabD, fabF, fabG, fabH, fabI, fabR, fabY, fabZ, fadR, folA, folB, folC, folD, folK, folP, gabT, gcl, gdhA, ggt, glnA, glnB, glsA1, glsA2, gltB, gltD, glyA, gph, gutQ, hchA, hemD, hemE, hisA, hisB, hisC, hisD, hisF, hisG, hisH, hisI, hisL, ilvA, ilvB, ilvC, ilvD, ilvE, ilvG, ilvH, ilvI, ilvL, ilvM, ilvN, ilvY, irp1, ivbL, kdsA, kdsB, kdsD, leuA, leuB, leuC, leuD, leuL, lipA, lipB, lpxL, lpxM, lpxP, ltaE, luxS, lysA, lysC, lysR, malY, metA, metAS, metB, metC, metE, metF, metH, metJ, metL, metR, mhpE, mhpF, mmuM, mmuP, msbB, mtnA, mtnN, nadA, nudB, pabA, pabB, pabC, panB, panC, panD, panE, panM, panZ, pheA, plsX, proA, proB, proC, pta, purU, putA, puuA, ridA, selA, selD, serA, serB, serC, serS, sul1, tdh, thrA, thrB, thrC, thrL, trpA, trpB, trpC, trpCF, trpD, trpE, trpGD, trpL, tyrA, tyrB, ubiC, ugd, usg, waaA, wcaB, yajL, ybiB, ydfG, ydiB, ygeW, ygfK, yhbO, yheT, yieE, yuaK]","[accB, accD, ackA, acpP, alaA, argA, argC, argD, argG, aroB, aroD, aroF, aroG, aroH, aroK, aroL, asd, asnB, aspC, avtA, bioA, bioD1, carA, carB, cfa, cysB, cysI, cysJ, cysK, cysM, dapB, dapD, dapE, dkgA, dkgB, fabA, fabD, fabF, fabG, fabH, fabI, fabY, fabZ, fadR, folA, folP, gabT, gdhA, glnA, glnB, gltB, gltD, glyA, gph, hisB, hisF, hisG, ilvA, ilvD, ilvH, ilvI, kdsA, leuA, leuB, ltaE, luxS, lysA, lysC, metB, metE, metF, metH, metL, mhpE, mmuM, panC, panZ, pheA, proA, proB, proC, pta, purU, selA, selD, serA, serB, serS, thrA, thrB, thrC, trpA, trpB, trpC, trpGD, tyrA, tyrB, ubiC, ydfG, yhbO]",,,,,,,,,"[Group12]","[5, 6]","{Group12=1.016303116329265E-31}","{Group12=1.626084986126824E-30}","GO:0046394",,"carboxylic%20acid%20biosynthetic%20process","100","GO_BiologicalProcess-Custom-GOA-ACAP-ARAP_04.11.2021_00h00","FALSE","false","carboxylic%20acid%20biosynthetic%20process","carboxylic acid biosynthetic process","8.443054167980415E-12","6.011454567602055E-9",,"GO:0046394"
