"41.30434799194336",,,"[FAZ83_02015, FAZ83_02925, aceE, aceF, adk, eno, fbaA, fbaB, gapA, glk, gmk, gpmA, gpmB, gpmI, gpmM, lpdA, mdh, pfkA, pfkB, pgi, pgk, ppk, ppk1, pykA, pykF, tpiA]","[aceF, adk, eno, fbaA, fbaB, gapA, gmk, gpmA, gpmB, gpmI, lpdA, mdh, pfkA, pfkB, pgk, ppk, pykA, pykF, tpiA]",,,,,,,,,"[Group15]","[6, 7, 8]","{Group15=4.724342098617546E-10}","{Group15=4.724342098617546E-9}","GO:0009135",,"purine%20nucleoside%20diphosphate%20metabolic%20process","19","GO_BiologicalProcess-Custom-GOA-ACAP-ARAP_04.11.2021_00h00","FALSE","false","purine%20nucleoside%20diphosphate%20metabolic%20process","purine nucleoside diphosphate metabolic process","1.1260209037634905E-6","7.578120682328291E-4",,"GO:0009135"
"33.54430389404297",,,"[FAZ83_00825, FAZ83_02015, FAZ83_02925, FAZ83_05685, FAZ83_06800, FAZ83_19190, accA, accC, accD, aceE, aceF, ackA, acs, adk, amn, apt, atpA, atpB, atpC, atpD, atpE, atpF, atpG, atpH, citE, citF, coaA, coaBC, coaD, coaE, cyaA, cysQ, eno, fadD, fbaA, fbaB, fliI, gapA, glk, gmk, gpmA, gpmB, gpmI, gpmM, gppA, gpt, gsk, guaA, guaB, guaC, hpt, lpdA, mdh, ndk, odhB, pfkA, pfkB, pgi, pgk, ppk, ppk1, pta, purA, purB, purC, purD, purE, purF, purH, purK, purL, purM, purN, purT, purU, pykA, pykF, relA, scpC, spoT, sucB, sucC, tesB, tpiA, yciA]","[accD, aceF, ackA, acs, adk, amn, apt, atpA, atpC, atpD, atpF, atpG, atpH, coaA, coaBC, coaE, cyaA, cysQ, eno, fbaA, fbaB, gapA, gmk, gpmA, gpmB, gpmI, gpt, guaA, guaB, guaC, hpt, lpdA, mdh, pfkA, pfkB, pgk, ppk, pta, purC, purE, purH, purM, purT, purU, pykA, pykF, relA, spoT, sucB, sucC, tesB, tpiA, yciA]",,,,,,,,,"[Group15]","[6, 7, 8, 9]","{Group15=4.724342098617546E-10}","{Group15=4.724342098617546E-9}","GO:0009150",,"purine%20ribonucleotide%20metabolic%20process","53","GO_BiologicalProcess-Custom-GOA-ACAP-ARAP_04.11.2021_00h00","FALSE","false","purine%20ribonucleotide%20metabolic%20process","purine ribonucleotide metabolic process","6.117966335850819E-12","4.368227963797485E-9",,"GO:0009150"
"30.92783546447754",,,"[FAZ83_00825, FAZ83_05685, FAZ83_06800, FAZ83_19190, accA, accC, accD, aceF, ackA, acs, adk, amn, apt, atpA, atpB, atpC, atpD, atpE, atpF, atpG, atpH, coaA, coaBC, coaD, coaE, cyaA, fliI, gppA, gpt, gsk, guaA, guaB, hpt, ndk, pta, purA, purB, purC, purD, purE, purF, purH, purK, purL, purM, purN, purT, purU, relA, spoT]","[accD, aceF, ackA, acs, adk, amn, apt, atpA, atpC, atpD, atpF, atpG, atpH, coaA, coaBC, coaE, cyaA, gpt, guaA, guaB, hpt, pta, purC, purE, purH, purM, purT, purU, relA, spoT]",,,,,,,,,"[Group15]","[7, 8, 9, 10]","{Group15=4.724342098617546E-10}","{Group15=4.724342098617546E-9}","GO:0009152",,"purine%20ribonucleotide%20biosynthetic%20process","30","GO_BiologicalProcess-Custom-GOA-ACAP-ARAP_04.11.2021_00h00","FALSE","false","purine%20ribonucleotide%20biosynthetic%20process","purine ribonucleotide biosynthetic process","1.7591604139228885E-6","0.0011786374773283352",,"GO:0009152"
"29.487178802490234",,,"[FAZ83_06800, FAZ83_14490, FAZ83_19190, add, adk, amn, apt, carA, carB, gmk, gpt, gsk, guaA, guaB, hpt, nagD, prs, purA, purB, purC, purD, purE, purF, purH, purK, purL, purM, purN, purT, purU, pyrB, pyrC, pyrD, pyrE, pyrF, ribF, surE, udk, udp, upp, ygjP]","[adk, amn, apt, carA, carB, gmk, gpt, guaA, guaB, hpt, nagD, prs, purC, purE, purH, purM, purT, purU, pyrB, pyrC, ribF, udk, upp]",,,,,,,,,"[Group15]","[6, 7, 8]","{Group15=4.724342098617546E-10}","{Group15=4.724342098617546E-9}","GO:0009161",,"ribonucleoside%20monophosphate%20metabolic%20process","23","GO_BiologicalProcess-Custom-GOA-ACAP-ARAP_04.11.2021_00h00","FALSE","false","ribonucleoside%20monophosphate%20metabolic%20process","ribonucleoside monophosphate metabolic process","6.481444816949699E-5","0.04115717458763059",,"GO:0009161"
"27.5510196685791",,,"[FAZ83_00825, FAZ83_01125, FAZ83_05685, FAZ83_06800, FAZ83_13135, FAZ83_14490, FAZ83_15230, FAZ83_18885, FAZ83_19190, accA, accC, accD, aceF, ackA, acs, add, adk, amn, apt, atpA, atpB, atpC, atpD, atpE, atpF, atpG, atpH, carA, carB, cmk, coaA, coaBC, coaD, coaE, cyaA, dcd, dut, feaB, fliI, folD, gmk, gppA, gpt, grxA, grxC, gsk, guaA, guaB, hpt, mobA, mocA, nadA, nadB, nadC, nadD, nadE, nadK, nadR, ndk, nrdA, nrdB, nrdD, nrdE, nrdF, phnN, pncA, pncB, pncC, prs, pta, purA, purB, purC, purD, purE, purF, purH, purK, purL, purM, purN, purR, purT, purU, pyrB, pyrC, pyrD, pyrE, pyrF, pyrG, pyrH, pyrI, pyrL, relA, ribF, spoT, tdk, thyA, tmk, udk, udp, upp, uspG, yfbR, ygjP]","[accD, aceF, ackA, acs, adk, amn, apt, atpA, atpC, atpD, atpF, atpG, atpH, carA, carB, cmk, coaA, coaBC, coaE, cyaA, dcd, dut, gmk, gpt, grxC, guaA, guaB, hpt, nadC, nadE, nadR, nrdA, nrdE, pncB, prs, pta, purC, purE, purH, purM, purT, purU, pyrB, pyrC, pyrG, pyrH, pyrI, relA, ribF, spoT, udk, upp, uspG, yfbR]",,,,,,,,,"[Group15]","[6, 7, 8]","{Group15=4.724342098617546E-10}","{Group15=4.724342098617546E-9}","GO:0009165",,"nucleotide%20biosynthetic%20process","54","GO_BiologicalProcess-Custom-GOA-ACAP-ARAP_04.11.2021_00h00","FALSE","false","nucleotide%20biosynthetic%20process","nucleotide biosynthetic process","1.3559226670326395E-8","9.382984855865865E-6",,"GO:0009165"
"41.30434799194336",,,"[FAZ83_02015, FAZ83_02925, aceE, aceF, adk, eno, fbaA, fbaB, gapA, glk, gmk, gpmA, gpmB, gpmI, gpmM, lpdA, mdh, pfkA, pfkB, pgi, pgk, ppk, ppk1, pykA, pykF, tpiA]","[aceF, adk, eno, fbaA, fbaB, gapA, gmk, gpmA, gpmB, gpmI, lpdA, mdh, pfkA, pfkB, pgk, ppk, pykA, pykF, tpiA]",,,,,,,,,"[Group15]","[7, 8, 9]","{Group15=4.724342098617546E-10}","{Group15=4.724342098617546E-9}","GO:0009179",,"purine%20ribonucleoside%20diphosphate%20metabolic%20process","19","GO_BiologicalProcess-Custom-GOA-ACAP-ARAP_04.11.2021_00h00","FALSE","false","purine%20ribonucleoside%20diphosphate%20metabolic%20process","purine ribonucleoside diphosphate metabolic process","1.1260209037634905E-6","7.578120682328291E-4",,"GO:0009179"
"41.66666793823242",,,"[FAZ83_02015, FAZ83_02925, aceE, aceF, adk, eno, fbaA, fbaB, gapA, glk, gmk, gpmA, gpmB, gpmI, gpmM, lpdA, mdh, pfkA, pfkB, pgi, pgk, ppk, ppk1, pykA, pykF, pyrH, tpiA]","[aceF, adk, eno, fbaA, fbaB, gapA, gmk, gpmA, gpmB, gpmI, lpdA, mdh, pfkA, pfkB, pgk, ppk, pykA, pykF, pyrH, tpiA]",,,,,,,,,"[Group15]","[6, 7, 8]","{Group15=4.724342098617546E-10}","{Group15=4.724342098617546E-9}","GO:0009185",,"ribonucleoside%20diphosphate%20metabolic%20process","20","GO_BiologicalProcess-Custom-GOA-ACAP-ARAP_04.11.2021_00h00","FALSE","false","ribonucleoside%20diphosphate%20metabolic%20process","ribonucleoside diphosphate metabolic process","4.960314791907293E-7","3.3581331141212375E-4",,"GO:0009185"
"32.98429489135742",,,"[FAZ83_00825, FAZ83_02015, FAZ83_02925, FAZ83_05685, FAZ83_06800, FAZ83_14490, FAZ83_19190, accA, accC, accD, aceE, aceF, ackA, acs, adk, amn, apt, atpA, atpB, atpC, atpD, atpE, atpF, atpG, atpH, carA, carB, citE, citF, coaA, coaBC, coaD, coaE, cyaA, cysQ, eno, fadD, fbaA, fbaB, fliI, gapA, glk, gmk, gpmA, gpmB, gpmI, gpmM, gppA, gpt, gsk, guaA, guaB, guaC, hpt, lpdA, mazG, mdh, nagD, ndk, odhB, pfkA, pfkB, pgi, pgk, ppk, ppk1, pta, purA, purB, purC, purD, purE, purF, purH, purK, purL, purM, purN, purT, purU, pykA, pykF, pyrB, pyrC, pyrD, pyrE, pyrF, pyrG, pyrH, relA, ribF, scpC, spoT, sucB, sucC, surE, tesB, tpiA, udk, udp, upp, yciA, ygjP]","[accD, aceF, ackA, acs, adk, amn, apt, atpA, atpC, atpD, atpF, atpG, atpH, carA, carB, coaA, coaBC, coaE, cyaA, cysQ, eno, fbaA, fbaB, gapA, gmk, gpmA, gpmB, gpmI, gpt, guaA, guaB, guaC, hpt, lpdA, mdh, nagD, pfkA, pfkB, pgk, ppk, pta, purC, purE, purH, purM, purT, purU, pykA, pykF, pyrB, pyrC, pyrG, pyrH, relA, ribF, spoT, sucB, sucC, tesB, tpiA, udk, upp, yciA]",,,,,,,,,"[Group13, Group15]","[5, 6, 7, 8]","{Group13=3.833292189351472E-9, Group15=4.724342098617546E-10}","{Group13=3.066633751481178E-8, Group15=4.724342098617546E-9}","GO:0009259",,"ribonucleotide%20metabolic%20process","63","GO_BiologicalProcess-Custom-GOA-ACAP-ARAP_04.11.2021_00h00","FALSE","false","ribonucleotide%20metabolic%20process","ribonucleotide metabolic process","1.4030090166823148E-13","1.0129725100446313E-10",,"GO:0009259"
"31.45161247253418",,,"[FAZ83_00825, FAZ83_05685, FAZ83_06800, FAZ83_14490, FAZ83_19190, accA, accC, accD, aceF, ackA, acs, adk, amn, apt, atpA, atpB, atpC, atpD, atpE, atpF, atpG, atpH, carA, carB, coaA, coaBC, coaD, coaE, cyaA, fliI, gppA, gpt, gsk, guaA, guaB, hpt, ndk, pta, purA, purB, purC, purD, purE, purF, purH, purK, purL, purM, purN, purT, purU, pyrB, pyrC, pyrD, pyrE, pyrF, pyrG, pyrH, relA, ribF, spoT, udk, udp, upp, ygjP]","[accD, aceF, ackA, acs, adk, amn, apt, atpA, atpC, atpD, atpF, atpG, atpH, carA, carB, coaA, coaBC, coaE, cyaA, gpt, guaA, guaB, hpt, pta, purC, purE, purH, purM, purT, purU, pyrB, pyrC, pyrG, pyrH, relA, ribF, spoT, udk, upp]",,,,,,,,,"[Group15]","[6, 7, 8, 9]","{Group15=4.724342098617546E-10}","{Group15=4.724342098617546E-9}","GO:0009260",,"ribonucleotide%20biosynthetic%20process","39","GO_BiologicalProcess-Custom-GOA-ACAP-ARAP_04.11.2021_00h00","FALSE","false","ribonucleotide%20biosynthetic%20process","ribonucleotide biosynthetic process","3.018759388435634E-8","2.070868940466845E-5",,"GO:0009260"
"26.623376846313477",,,"[cheA, cheY, clpA, clpB, clpP, clpS, cspA, cspB, cspG, cspI, deaD, degP, dnaJ, dnaK, dsbB, dtd, envY, eutD, gloB, groES, groL, groS, grpE, hflC, hflD, hflK, hflX, hscA, hslJ, hslO, hslR, hslU, hslV, hspQ, htpG, htpX, ibpA, ibpB, infC, ldhA, lepA, loiP, lon, lpxP, lsrR, marR, miaA, mngR, moaA, nudF, oppA, otsA, otsB, patZ, phoU, pncB, pnp, pphA, pspA, pykF, raiA, rbfA, rhlE, rnr, rpoD, rpoE, rpoH, slyD, sodA, ssuD, tig, ttdB, ves, yajL, ybeD, ybeY, yccX, ydfK, yebS, yfcA, yggE, yhbO, ynaE, yobF, yoeB, yuaZ]","[clpA, clpB, clpP, cspI, dnaJ, dnaK, gloB, groS, grpE, hflC, hflK, hflX, hslJ, hslO, hslU, hslV, ibpA, ibpB, infC, ldhA, lepA, lon, oppA, otsA, otsB, pncB, pnp, pspA, pykF, raiA, rbfA, rnr, rpoD, rpoE, rpoH, slyD, tig, ybeD, ybeY, yggE, yhbO]",,,,,,,,,"[Group06]","[3]","{Group06=2.0219350989998548E-6}","{Group06=8.087740395999419E-6}","GO:0009266",,"response%20to%20temperature%20stimulus","41","GO_BiologicalProcess-Custom-GOA-ACAP-ARAP_04.11.2021_00h00","TRUE","false","response%20to%20temperature%20stimulus","response to temperature stimulus","2.0219350989998548E-6","0.001350652646131903",,"GO:0009266"
"28.571428298950195",,,"[clpA, clpB, clpP, clpS, degP, dnaJ, dnaK, dsbB, dtd, eutD, gloB, groES, groL, groS, grpE, hflC, hflD, hflK, hflX, hslJ, hslO, hslR, hslU, hslV, hspQ, htpG, ibpA, ibpB, ldhA, loiP, lon, lsrR, marR, miaA, mngR, moaA, nudF, oppA, patZ, phoU, pncB, pnp, pspA, pykF, rhlE, rpoD, rpoH, slyD, sodA, ssuD, tig, ttdB, yajL, ybeD, ybeY, yccX, yebS, yfcA, yggE, yhbO, yobF, yoeB, yuaZ]","[clpA, clpB, clpP, dnaJ, dnaK, gloB, groS, grpE, hflC, hflK, hflX, hslJ, hslO, hslU, hslV, ibpA, ibpB, ldhA, lon, oppA, pncB, pnp, pspA, pykF, rpoD, rpoH, slyD, tig, ybeD, ybeY, yggE, yhbO]",,,,,,,,,"[Group06]","[3, 4]","{Group06=2.0219350989998548E-6}","{Group06=8.087740395999419E-6}","GO:0009408",,"response%20to%20heat","32","GO_BiologicalProcess-Custom-GOA-ACAP-ARAP_04.11.2021_00h00","FALSE","false","response%20to%20heat","response to heat","5.391860636966491E-6","0.003547844299123951",,"GO:0009408"
"17.208271026611328",,,"[B8LFD5, FAZ83_00065, FAZ83_00160, FAZ83_00345, FAZ83_00350, FAZ83_00430, FAZ83_00680, FAZ83_00705, FAZ83_01055, FAZ83_01105, FAZ83_01365, FAZ83_01505, FAZ83_01775, FAZ83_01830, FAZ83_02020, FAZ83_02295, FAZ83_02350, FAZ83_02450, FAZ83_02820, FAZ83_03010, FAZ83_03350, FAZ83_03555, FAZ83_03835, FAZ83_03905, FAZ83_04365, FAZ83_04470, FAZ83_04480, FAZ83_04835, FAZ83_05025, FAZ83_05280, FAZ83_05390, FAZ83_05515, FAZ83_05550, FAZ83_05555, FAZ83_05605, FAZ83_05640, FAZ83_05705, FAZ83_05745, FAZ83_06015, FAZ83_06475, FAZ83_07525, FAZ83_07585, FAZ83_08200, FAZ83_08290, FAZ83_08310, FAZ83_08320, FAZ83_08405, FAZ83_08440, FAZ83_08530, FAZ83_08640, FAZ83_08645, FAZ83_08670, FAZ83_08695, FAZ83_08740, FAZ83_08745, FAZ83_08905, FAZ83_09620, FAZ83_09720, FAZ83_10055, FAZ83_10440, FAZ83_10845, FAZ83_10930, FAZ83_10935, FAZ83_10940, FAZ83_11140, FAZ83_11440, FAZ83_11460, FAZ83_11575, FAZ83_11580, FAZ83_11865, FAZ83_11940, FAZ83_11960, FAZ83_12075, FAZ83_12675, FAZ83_12680, FAZ83_12970, FAZ83_13010, FAZ83_13165, FAZ83_13290, FAZ83_13305, FAZ83_13360, FAZ83_13685, FAZ83_13725, FAZ83_13785, FAZ83_13900, FAZ83_14105, FAZ83_14975, FAZ83_15385, FAZ83_15415, FAZ83_15530, FAZ83_15545, FAZ83_15655, FAZ83_15700, FAZ83_15850, FAZ83_16020, FAZ83_16260, FAZ83_17470, FAZ83_17650, FAZ83_17725, FAZ83_17745, FAZ83_17925, FAZ83_18270, FAZ83_18520, FAZ83_18525, FAZ83_19145, FAZ83_19455, FAZ83_19495, FAZ83_19575, FAZ83_20090, FAZ83_20250, FAZ83_20265, FAZ83_20300, FAZ83_20350, FAZ83_20355, FAZ83_20445, FAZ83_20885, FAZ83_21150, FAZ83_21695, FAZ83_21875, FAZ83_21940, FAZ83_21975, FAZ83_22410, FAZ83_23080, FAZ83_23105, FAZ83_23175, FAZ83_23345, FAZ83_23380, FAZ83_23440, FAZ83_23660, FAZ83_23880, FAZ83_24430, FAZ83_24910, FAZ83_24915, FAZ83_25015, FAZ83_25100, FAZ83_25380, FAZ83_25705, aaeR, abgR, abrB, accD, acnB, acrR, ada, adiY, aes, agaR, aidB, alaS, allR, allS, alpA, alsK, appY, araC, arcA, arcA2, arcB, arfA, arfB, argL, argP, argR, argS, arsR, ascG, aslB, asnC, asnS, aspS, atoC, atoS, baeR, basR, baxL, bdcR, betI, bglG, bglJ, birA, bluF, bluR, bolA, bssR, btsR, cadC, caiF, casE, cbl, cca, cdaR, cecR, chbR, chpB, cmoA, cmoB, cmoM, cnu, comR, cpxR, cra, creB, crl, crp, csdE, csgD, csiE, csiR, cspA, cspB, cspC, cspD, cspE, cspF, cspG, cspH, cspI, csqR, csrA, cueR, cusR, cynR, cysB, cysS, cytR, dctR, dcuR, dcuS, deaD, decR, def, deoR, dgcM, dgoR, dhaR, dicA, dinJ, dksA, dmlR, dnaJ, dnaK, dpiA, dpiB, dsdC, dusA, dusB, dusC, ebgR, ecpR, efp, eilA, emrR, envR, envY, epmA, erpA, ettA, eutR, evgA, exuR, fabR, fadR, fdhE, feaR, fecI, fecR, fhlA, fimZ, fis, flgM, flhC, flhD, fliA, fliZ, flk, fmt, fnr, frlR, frmR, frr, ftsK, fucR, fur, fusA, gadE, gadW, gadX, galR, galS, gatR, gcvA, gcvH, gcvR, glaR, glcC, glnG, glnL, glnS, glpR, glrR, gltX, gluQ, gluQRS, glyQ, glyS, gntR, greA, greB, gspO, gutM, gyrA, gyrB, hcaR, hdfR, hexR, hflX, hfq, hha, hicA, higA, higB, hipA, hipB, hisS, hns, hpf, hprR, hrpA, hscA, hscB, hupA, hupB, hyaD, hybD, hybE, hybF, hybG, hycI, hyfR, hypA, hypB, hypC, hypD, hypE, hypF, hypT, iaaA, iclR, idlP, idnR, ihfA, ihfB, ileS, ilvL, ilvY, infA, infB, infC, insH5, iraD, iraM, iraP, iscA, iscR, iscS, kdgR, kdpE, kptA, lacI, lasT, lepA, lepB, leuO, leuS, lexA, lgoR, lipA, lipB, lit, lldR, lolA, lplA, lrhA, lrp, lsrR, lysP, lysR, lysS, lysU, malI, malT, malY, marA, marR, matP, mazF, mcbR, melR, metG, metJ, metR, mfd, mgtL, mhpR, miaA, miaB, mlc, mlrA, mngR, mnmA, mnmC, mnmE, mnmG, mnmH, mntR, modE, mprA, mqsA, mqsR, mraZ, mtfA, mtlR, murR, nac, nagC, nanR, narL, narP, nemR, nfuA, nhaR, nikR, nimR, norR, nrdR, nsrR, ntrB, ntrC, nudC, nusA, nusB, nusG, ompR, oxyR, paaX, panD, panM, panZ, pcnB, pdeL, pdeR, pdhR, pepA, perR, pgrR, pheM, pheS, pheT, phnF, phoB, phoP, phoR, phoU, pnp, pppA, prfA, prfB, prfC, prfH, prlC, prlF, prmC, proQ, proS, prpR, psd, pspA, pspB, pspF, pth, purR, putA, puuR, pyrL, qseB, queA, queG, queH, quuD, quuQ, racR, radD, raiA, rapA, rapZ, ratA, rbbA, rbfA, rbn, rbsR, rcdA, rclR, rcnR, rcsA, rcsB, rcsC, relB, relE, rfaH, rhaR, rhaS, rhmR, rho, rhoL, rimI, rimJ, rimK, rimL, rimM, rimO, rimP, rlhA, rlmA, rlmB, rlmC, rlmD, rlmE, rlmF, rlmG, rlmH, rlmI, rlmJ, rlmKL, rlmL, rlmM, rlmN, rluA, rluB, rluC, rluD, rluE, rluF, rmf, rnb, rnc, rnd, rne, rng, rnk, rnlA, rnpA, rnr, rnt, rob, robA, rof, rph, rpiR, rplA, rplB, rplC, rplD, rplE, rplF, rplI, rplJ, rplK, rplL, rplM, rplN, rplO, rplP, rplQ, rplR, rplS, rplT, rplU, rplV, rplW, rplX, rplY, rpmA, rpmB, rpmC, rpmD, rpmE, rpmE2, rpmF, rpmG, rpmH, rpmI, rpmJ, rpoA, rpoB, rpoC, rpoD, rpoE, rpoH, rpoN, rpoS, rpoZ, rppH, rpsA, rpsB, rpsC, rpsD, rpsE, rpsF, rpsG, rpsH, rpsI, rpsJ, rpsK, rpsL, rpsM, rpsN, rpsO, rpsP, rpsQ, rpsR, rpsS, rpsT, rpsU, rraB, rsd, rseA, rseD, rseP, rsfS, rsmA, rsmB, rsmC, rsmD, rsmE, rsmF, rsmG, rsmH, rsmI, rsmJ, rspR, rssB, rstA, rsuA, rtcA, rtcB, rtcR, rutR, ruvX, sdiA, secM, selA, selB, selD, selU, seqA, serS, sfsA, sgcR, sgrR, skp, slmA, slyA, slyD, smpB, soxR, soxS, speFL, sppA, sra, srlR, sspA, stpA, sufA, suhB, sutR, sxy, symE, tadA, tapT, tcdA, tdcA, tdcR, tgt, thiI, thrL, thrS, thyA, tilS, tmcA, tnaC, torD, torI, torR, torT, traJ, treR, trhO, trhP, trmA, trmB, trmD, trmG, trmH, trmJ, trmL, trmN, trmO, trpR, trpS, truA, truB, truC, truD, tsaB, tsaC, tsaD, tsaE, tsf, ttcA, ttdR, tufA, tufB, tusA, tusB, tusC, tusD, tusE, tyrR, tyrS, uacR, uhpA, uidR, ulaR, umuD, uof, uvrY, uxuR, valS, xapR, xylR, xynR, yacG, yafC, yafN, yafO, yafQ, yahB, ybaK, ybcJ, ybcM, ybdO, ybeF, ybeY, ybfE, ybfI, ybhD, ybtA, ycaN, ycgZ, yciH, yciT, ycjW, ydcI, ydcR, ydeM, ydeO, ydhB, ydiP, ydiV, ydjF, yeaK, yebC, yeeN, yeeY, yefM, yegW, yeiE, yeiL, yeiP, yfeR, yfhH, yfhL, yfiC, yfiE, yfiF, yfjP, yfjR, ygaV, ygbI, ygcP, ygeH, ygeK, ygfI, ygfZ, ygiV, yhaJ, yhbY, yhfY, yhgF, yhjB, yhjC, yiaJ, yiaU, yidL, yidP, yidZ, yieP, yigZ, yihL, yiiE, yiiF, yijO, yjdC, yjhI, yjiE, yjiR, yjjQ, ykfA, ykfJ, ykgA, ykgM, ykgO, yneJ, yneL, ynfL, yoeB, ypdB, ypdC, yqeH, yqeI, yqgF, yqhC, yqjI, yuaB, zntR, zraR, zur]","[accD, acnB, allR, alsK, arcA, arcB, argP, asnS, aspS, baeR, cmoA, cmoM, cpxR, crl, crp, csdE, cspC, cspE, cspI, csrA, cysB, dcuS, def, deoR, dgoR, dksA, dnaJ, dnaK, ettA, evgA, fadR, fdhE, fecR, fnr, frr, ftsK, fur, fusA, gcvH, gcvR, glpR, gltX, glyS, gntR, greA, gyrA, hexR, hflX, hfq, hipA, hisS, hns, hscB, hupA, hupB, hypB, iaaA, ihfA, ihfB, infA, infB, infC, iscA, iscS, kdgR, lacI, lepA, leuS, lrhA, lrp, lysU, matP, mhpR, miaB, mlc, mnmA, modE, mprA, mtfA, nagC, narL, nfuA, nikR, nrdR, nusA, ompR, oxyR, panZ, pcnB, pdhR, pepA, pheS, pheT, phoB, phoP, pnp, prfA, prfB, prfC, prlF, proS, pspA, pspB, pth, raiA, rapA, rapZ, rbfA, rcsB, rho, rimM, rlmA, rlmC, rlmE, rlmI, rlmJ, rlmM, rluC, rmf, rnb, rnc, rng, rnk, rnr, rnt, rof, rplB, rplC, rplD, rplE, rplF, rplI, rplJ, rplK, rplL, rplM, rplN, rplO, rplP, rplQ, rplS, rplT, rplU, rplV, rplW, rplY, rpmA, rpmB, rpmC, rpmD, rpmE, rpmF, rpoA, rpoB, rpoC, rpoD, rpoE, rpoH, rpsA, rpsB, rpsC, rpsD, rpsE, rpsF, rpsG, rpsH, rpsI, rpsJ, rpsK, rpsL, rpsM, rpsN, rpsO, rpsP, rpsQ, rpsR, rpsS, rpsT, rraB, rsmB, rsmG, rstA, selA, selD, selU, seqA, serS, skp, slyD, smpB, sra, sspA, stpA, sufA, suhB, tcdA, thiI, thrS, treR, trhP, trmD, trmH, trmJ, trpR, trpS, truA, truB, tsaB, tsaE, tsf, tyrR, tyrS, uacR, valS, xynR, ybaK, ybeY, yciH, yciT, ydcI, yebC, yeiE, yeiP, yfiF, ygfZ, yhgF, yjdC, yjiR, ykgM, yneJ, yqgF, yqjI, zur]",,,,,,,,,"[Group14, Group16]","[4]","{Group14=1.9697693126353342E-19, Group16=6.427747381108677E-28}","{Group14=2.1667462438988677E-18, Group16=9.641621071663015E-27}","GO:0010467",,"gene%20expression","233","GO_BiologicalProcess-Custom-GOA-ACAP-ARAP_04.11.2021_00h00","FALSE","false","gene%20expression","gene expression","7.950511503479257E-8","5.414298333869374E-5",,"GO:0010467"
"25.170068740844727",,,"[FAZ83_00680, FAZ83_04835, FAZ83_06475, FAZ83_22410, FAZ83_23175, FAZ83_23345, FAZ83_25380, FAZ83_25705, accD, acnB, arfA, arfB, argL, baxL, chpB, csrA, deaD, efp, epmA, ettA, fusA, greA, greB, hflX, hfq, higB, hns, hpf, idlP, ihfA, ihfB, infA, infB, infC, lepA, lit, mazF, miaA, mqsR, nudC, pdeR, prfA, prfB, prfC, prfH, proQ, raiA, rapZ, ratA, rbbA, relE, rfaH, rmf, rplA, rplD, rplJ, rplM, rplT, rplY, rppH, rpsA, rpsD, rpsG, rpsH, rpsO, rseD, rsfS, secM, selA, selB, speFL, thrS, thyA, tsf, tufA, tufB, uof, valS, yafO, yciH, yeaK, yeiP, yigZ, yoeB]","[accD, acnB, csrA, ettA, fusA, greA, hflX, hfq, hns, ihfA, ihfB, infA, infB, infC, lepA, prfA, prfB, prfC, raiA, rapZ, rmf, rplD, rplJ, rplM, rplT, rplY, rpsA, rpsD, rpsG, rpsH, rpsO, selA, thrS, tsf, valS, yciH, yeiP]",,,,,,,,,"[Group10, Group16]","[5, 6]","{Group10=2.522363292263363E-20, Group16=6.427747381108677E-28}","{Group10=3.0268359507160356E-19, Group16=9.641621071663015E-27}","GO:0010608",,"posttranscriptional%20regulation%20of%20gene%20expression","37","GO_BiologicalProcess-Custom-GOA-ACAP-ARAP_04.11.2021_00h00","FALSE","false","posttranscriptional%20regulation%20of%20gene%20expression","posttranscriptional regulation of gene expression","2.5042408502276048E-5","0.01615235348396805",,"GO:0010608"
"40.0",,,"[rplA, rplB, rplC, rplD, rplE, rplF, rplI, rplJ, rplK, rplL, rplM, rplN, rplO, rplP, rplQ, rplR, rplS, rplT, rplU, rplV, rplW, rplX, rplY, rpmA, rpmB, rpmC, rpmD, rpmE, rpmF, rpmG, rpmI, rpmJ]","[rplB, rplC, rplD, rplE, rplF, rplI, rplJ, rplK, rplL, rplM, rplN, rplO, rplP, rplQ, rplS, rplT, rplU, rplV, rplW, rplY, rpmA, rpmB, rpmC, rpmD, rpmE, rpmF]",,,,,,,,,"[Group16]","[4, 7]","{Group16=6.427747381108677E-28}","{Group16=9.641621071663015E-27}","GO:0015934",,"large%20ribosomal%20subunit","26","GO_CellularComponent-Custom-GOA-ACAP-ARAP_04.11.2021_00h00","FALSE","false","large%20ribosomal%20subunit","large ribosomal subunit","2.6689913039241496E-8","1.8335970257958907E-5",,"GO:0015934"
"45.83333206176758",,,"[hpf, raiA, rbbA, rpsA, rpsB, rpsC, rpsD, rpsE, rpsF, rpsG, rpsH, rpsI, rpsJ, rpsK, rpsL, rpsM, rpsN, rpsO, rpsP, rpsQ, rpsR, rpsS, rpsT, rpsU, sra]","[raiA, rpsA, rpsB, rpsC, rpsD, rpsE, rpsF, rpsG, rpsH, rpsI, rpsJ, rpsK, rpsL, rpsM, rpsN, rpsO, rpsP, rpsQ, rpsR, rpsS, rpsT, sra]",,,,,,,,,"[Group16]","[4, 7]","{Group16=6.427747381108677E-28}","{Group16=9.641621071663015E-27}","GO:0015935",,"small%20ribosomal%20subunit","22","GO_CellularComponent-Custom-GOA-ACAP-ARAP_04.11.2021_00h00","FALSE","false","small%20ribosomal%20subunit","small ribosomal subunit","1.6061684216286922E-8","1.1098623793454263E-5",,"GO:0015935"
