"% Associated Genes","% Common Gene","%Genes Cluster #","All Associated Genes","Associated Genes Found","CEREBRAL_DOWNSTRAM_INFO","CEREBRAL_DOWNSTRAM_INFO_ALL","CEREBRAL_LOCALIZATION_INFO","CEREBRAL_LOCALIZATION_INFO_ALL","Cluster","Common Genes","ENSEMBL_GENE_ID","GeneType","GOGroups","GOLevels","Group PValue","Group PValue Corrected with Bonferroni step down","ID","Input Gene ID","name","Nr. Genes","Ontology Source","OverViewTerm","selected","shared name","Term","Term PValue","Term PValue Corrected with Bonferroni step down","UniProtKB_AC","UNIQUE_ID"
"35.08771896362305",,,"[bipA, crfC, dbpA, deaD, der, rlmE, rluD, rplA, rplB, rplC, rplE, rplF, rplK, rplP, rplQ, rplS, rplT, rplW, rplX, rplY, rpmA, rpmB, rpmC, rpmD, rpmF, rpmG, srmB, typA, ygcB, yhbY]","[bipA, der, rlmE, rplB, rplC, rplE, rplF, rplK, rplP, rplQ, rplS, rplT, rplW, rplY, rpmA, rpmB, rpmC, rpmD, rpmF, srmB]",,,,,,,,,"[Group16]","[6, 7, 8]","{Group16=6.427747381108677E-28}","{Group16=9.641621071663015E-27}","GO:0000027",,"ribosomal%20large%20subunit%20assembly","20","GO_BiologicalProcess-Custom-GOA-ACAP-ARAP_04.11.2021_00h00","FALSE","false","ribosomal%20large%20subunit%20assembly","ribosomal large subunit assembly","1.1596470451260937E-5","0.007537705793319609",,"GO:0000027"
"37.5",,,"[era, rimM, rimP, rpsA, rpsB, rpsC, rpsD, rpsE, rpsG, rpsH, rpsK, rpsN, rpsO, rpsP, rpsQ, rpsS, rpsT, rpsU, rsmA, yhbY]","[rimM, rpsA, rpsB, rpsC, rpsD, rpsE, rpsG, rpsH, rpsK, rpsN, rpsO, rpsP, rpsQ, rpsS, rpsT]",,,,,,,,,"[Group16]","[6, 7, 8]","{Group16=6.427747381108677E-28}","{Group16=9.641621071663015E-27}","GO:0000028",,"ribosomal%20small%20subunit%20assembly","15","GO_BiologicalProcess-Custom-GOA-ACAP-ARAP_04.11.2021_00h00","FALSE","false","ribosomal%20small%20subunit%20assembly","ribosomal small subunit assembly","5.939176777224205E-5","0.03789194783869043",,"GO:0000028"
"20.464134216308594",,,"[FAZ83_00075, FAZ83_00360, FAZ83_00715, FAZ83_01365, FAZ83_02015, FAZ83_02210, FAZ83_02250, FAZ83_02490, FAZ83_02515, FAZ83_02805, FAZ83_02810, FAZ83_02825, FAZ83_02870, FAZ83_02925, FAZ83_03045, FAZ83_03195, FAZ83_03635, FAZ83_04255, FAZ83_04275, FAZ83_04575, FAZ83_05140, FAZ83_05225, FAZ83_05370, FAZ83_05685, FAZ83_05690, FAZ83_05745, FAZ83_05800, FAZ83_05965, FAZ83_05975, FAZ83_06145, FAZ83_06165, FAZ83_06335, FAZ83_06790, FAZ83_06800, FAZ83_07225, FAZ83_07585, FAZ83_08130, FAZ83_08380, FAZ83_08555, FAZ83_08630, FAZ83_08690, FAZ83_08795, FAZ83_09275, FAZ83_09320, FAZ83_09900, FAZ83_09940, FAZ83_10305, FAZ83_10835, FAZ83_10935, FAZ83_10940, FAZ83_11195, FAZ83_11250, FAZ83_11265, FAZ83_11335, FAZ83_12175, FAZ83_12485, FAZ83_13135, FAZ83_13140, FAZ83_14020, FAZ83_14085, FAZ83_14090, FAZ83_14160, FAZ83_14890, FAZ83_15400, FAZ83_15575, FAZ83_15660, FAZ83_15665, FAZ83_15805, FAZ83_15840, FAZ83_15930, FAZ83_15975, FAZ83_16225, FAZ83_16350, FAZ83_16610, FAZ83_16820, FAZ83_16825, FAZ83_16975, FAZ83_17400, FAZ83_17520, FAZ83_18695, FAZ83_18875, FAZ83_19085, FAZ83_19245, FAZ83_19525, FAZ83_19565, FAZ83_19635, FAZ83_19715, FAZ83_20225, FAZ83_20240, FAZ83_20265, FAZ83_20510, FAZ83_20520, FAZ83_20655, FAZ83_21350, FAZ83_21375, FAZ83_21545, FAZ83_21865, FAZ83_22155, FAZ83_22410, FAZ83_22450, FAZ83_22680, FAZ83_22845, FAZ83_22895, FAZ83_23345, FAZ83_23390, FAZ83_23955, FAZ83_24545, FAZ83_24560, FAZ83_24620, FAZ83_24625, FAZ83_24655, FAZ83_24755, FAZ83_25045, FAZ83_25225, FAZ83_25380, FAZ83_25705, aadA1, aas, accA, accC, accD, aceK, ackA, acs, adk, adrA, ahpF, alaS, alsA, alsK, anmK, apbC, apbE, aph(3'')-Ib, araB, araG, arcB, arcC, argB, argC, argG, argK, argS, arnA, aroB, aroC, aroE, aroK, aroL, artP, asd, asnA, asnB, asnS, aspS, atoC, atoS, atpA, atpC, atpD, atpG, azoR, baeS, barA, basS, bax, bcsA, bcsE, bcsQ, bdcA, betA, bioD, bioD1, bioD2, bipA, birA, bluF, btsS, btuD, btuR, cadA, caiA, carA, carB, cbrA, cca, ccmA, cdgI, cheA, chrR, citC, citG, clpA, clpB, clpX, cmk, coaA, coaBC, coaD, coaE, cobA, cobB, cobO, cobU, copA, corC, cpdA, cpdB, cpsB, cpxA, creC, crfC, crp, cusS, cvrA, cyaA, cydC, cydD, cysA, cysC, cysD, cysG, cysI, cysJ, cysN, cysS, dapB, dbpA, dcd, dcuS, ddl, ddlA, ddlB, ddpD, ddpF, deaD, der, dfrA24, dgcC, dgcE, dgcF, dgcI, dgcJ, dgcM, dgcN, dgcP, dgcQ, dgcT, dgcZ, dgkA, dgoK, dhaL, dhaR, dinG, dld, dlgD, dmlA, dnaA, dnaB, dnaC, dnaJ, dnaK, dnaX, dosC, dpiB, dppD, dppF, dusA, dusB, dusC, dxr, engB, entE, entF, envZ, epd, epmA, era, etk, ettA, eutP, eutT, evgS, fabG, fabI, fadB, fadD, fadE, fadH, fadJ, fadK, fadR, fbp, fbpC, fcl, fecE, feoB, fepC, fetA, ffh, fhlA, fhuC, fic, fixB, fixC, fldA, fldB, fliI, folA, folC, folE, folK, fpr, frdA, fre, frlD, fruB, fruK, ftnA, ftsA, ftsE, ftsH, ftsK, ftsY, ftsZ, fucK, fusA, gabD, galE, galK, gap, gapA, garK, garR, gcl, ghrA, ghrB, glcD, glcE, glf, glgC, glk, glnA, glnB, glnE, glnG, glnK, glnL, glnQ, glnS, glpA, glpB, glpD, glpK, glrK, glrR, gltA, gltL, gltX, gluQ, gluQRS, glxK, glxR, glyQ, glyS, gmd, gmk, gnd, gndA, gntK, gor, gorA, gpmA, gpsA, gpt, groES, groL, groS, grpE, grxA, gshA, gshB, gsiA, gsk, gspA, gspE, gss, guaA, guaB, gutQ, gyrA, gyrB, hcaD, hcr, hda, hdhA, helD, hemA, hemG, hflX, hinT, hipA, hisD, hisG, hisI, hisP, hisS, hldD, hldE, hmp, hmpA, hmuV, hofB, hprS, hpt, hrpA, hrpB, hscA, hscC, hsdR, hslU, hslV, htpG, hycE, hyfG, hyfR, hypB, icd, idnK, ileS, ilvB, ilvC, ilvG, ilvI, infB, ispC, ispE, kdgK, kdpB, kdpC, kdpD, kduD, kefC, kefF, kefG, ldhA, lepA, leuB, leuS, lhgD, lhgO, lhr, ligA, livF, livG, lldD, lolA, lolD, lon, lpdA, lplA, lptB, lpxK, lsrA, ltnD, lysC, lysS, lysU, lyx, macB, maeA, maeB, mak, malK, malT, manC, mazG, mcrA, mcrB, mdaB, mdlA, mdlB, meaB, melA, menE, metF, metG, metK, metL, metN, mfd, mglA, mgtA, mhpA, mhpF, miaA, minD, mioC, mlaF, mnmA, mnmC, mnmE, mnmG, moaA, moaB, moaD, mobA, mobB, mocA, modC, modF, moeB, mog, mpl, mqo, mreB, mrp, msbA, msrQ, mukB, murB, murC, murD, murE, murF, mutL, mutS, nadB, nadD, nadE, nadK, nadR, nagK, nanK, narL, narP, narQ, narX, ndh, ndk, nemA, nfsA, nfsB, nhaP2, nikD, nikE, nirB, nnr, nnrD, norR, norV, norW, nrdA, nrdD, nrdE, nrdI, nrdR, ntrB, ntrC, nuoC, nuoF, nusA, obg, obgE, oppD, oppF, otnK, oxc, paaE, paaH, paaJ, paaK, panC, panE, panM, panZ, paoB, parC, parE, pat, patD, patZ, pckA, pcnB, pdeF, pdeH, pdeR, pdxA, pdxB, pdxH, pdxK, pdxY, pfkA, pfkB, pgk, pheS, pheT, phnC, phnK, phnL, phnN, phoH, phoQ, phoR, phrB, pnp, pntA, pntB, polB, potA, potG, poxB, ppk, ppk1, ppnN, ppsA, ppsR, preA, prfC, priA, prkB, proA, proB, proS, proV, prpE, prpR, prs, pspF, pstB, psuK, purA, purC, purD, purK, purL, purM, purT, putA, puuA, pxpA, pxpB, pxpC, pykA, pykF, pyrD, pyrG, pyrH, qseC, queC, radA, radD, rapA, rapZ, rarA, ravA, rbbA, rbsA, rbsK, rclA, rcsC, rcsD, rdgB, recA, recB, recC, recD, recF, recG, recN, recQ, relA, rep, repE, rfaD, rfaP, rfaY, rhaB, rhlB, rhlE, rho, ribA, ribD, ribF, rimK, rnc, rnd, rsgA, rstB, rsxG, rtcA, rtcB, rtcR, rutE, rutF, ruvA, ruvB, sapD, sapF, sbcC, sbmA, sdhA, secA, selB, selD, selO, serA, serS, sitB, solA, srkA, srmB, ssuB, sthA, sucA, sucC, sucD, sufC, surE, tauB, tcdA, tcyN, tdcB, tdcD, tdk, thiD, thiF, thiI, thiK, thiL, thiM, thiQ, thiS, thrA, thrB, thrS, tilS, tmcA, tmk, torS, traD, traI, trkA, trpS, trxB, tsaC, tsaE, tsf, tssH, ttcA, tufA, tufB, typA, tyrA, tyrR, tyrS, uacR, ubiB, ubiF, ubiH, ubiI, udk, udp, ugd, ugpC, uhpB, upp, usg, ushA, uspF, uup, uvrA, uvrB, uvrD, valS, wecC, wrbA, wzc, xdhB, xylB, xylG, yadG, yajQ, ybaL, ybbA, ybdK, ybeZ, ybhF, ybiT, ybjD, ybtP, ybtQ, ybtU, ycaK, ycbZ, yceM, ycgR, ychF, yciA, yciV, ycjS, ycjV, ycjX, ydaV, ydcT, yddA, yddH, ydgJ, ydiJ, ydiO, ydiR, ydiS, ydjA, yecC, yeeZ, yegD, yegH, yegI, yegS, yehL, yehX, yeiR, yejF, yfbR, yfdG, yfjD, yfjL, yfjP, ygcB, ygcQ, ygcU, ygfA, ygfM, yggC, yggR, yghR, yghS, yghT, ygiC, ygjP, ygjR, yhdZ, yheS, yhhX, yihU, yihV, yjfC, yjhC, yjiA, yjjG, yjjX, ykfA, yniA, ynjD, yoaA, yoaE, yoeF, yojI, ypdA, yphE, yqcA, yqeC, yqjH, yraR, ytfL, ytfR, yuaC, yuaR, yuaV, yubQ, zapE, zntA, znuC, zraR, zraS, zwf]","[accD, ackA, acs, adk, ahpF, alsK, arcB, argC, argG, aroB, aroK, aroL, artP, asd, asnB, asnS, aspS, atpA, atpC, atpD, atpG, azoR, baeS, barA, bioD1, bipA, carA, carB, clpA, clpB, clpX, cmk, coaA, coaBC, coaE, copA, corC, cpdA, cpxA, crp, cvrA, cyaA, cysC, cysI, cysJ, dapB, dcd, dcuS, ddlA, der, dgcP, dgcQ, dgkA, dhaL, dld, dnaA, dnaJ, dnaK, dppD, dppF, dxr, engB, entE, entF, epd, etk, ettA, fabG, fabI, fadR, fbp, feoB, ffh, fhuC, folA, folE, fpr, fre, fruB, fruK, ftnA, ftsA, ftsE, ftsH, ftsK, ftsZ, fusA, gabD, galE, galK, gapA, ghrA, glgC, glnA, glnB, glnK, glpD, glpK, gltA, gltX, glyS, gmk, gor, gpmA, gpsA, gpt, groS, grpE, gshA, gsiA, gss, guaA, guaB, gyrA, hemG, hflX, hinT, hipA, hisG, hisS, hldD, hldE, hpt, hslU, hslV, hypB, icd, ilvI, infB, ispE, kdgK, kefG, ldhA, lepA, leuB, leuS, livG, lon, lpdA, lptB, lysC, lysU, macB, maeB, mak, mdaB, metF, metK, metL, metN, mglA, mgtA, minD, mioC, mnmA, moaB, moaD, mobB, modC, mreB, msbA, mukB, murC, murD, murF, mutL, nadE, nadR, nagK, narL, ndh, nfsA, nrdA, nrdE, nrdR, nuoC, nuoF, nusA, oppD, panC, panZ, parC, parE, pckA, pcnB, pdxA, pdxB, pdxH, pdxK, pdxY, pfkA, pfkB, pgk, pheS, pheT, pnp, pntA, pntB, potG, poxB, ppk, ppnN, ppsR, prfC, prkB, proA, proB, proS, proV, prs, pstB, purC, purM, purT, pxpB, pykA, pykF, pyrG, pyrH, queC, rapA, rapZ, ravA, rclA, rcsD, recA, recF, relA, rhlB, rho, ribA, ribD, ribF, rnc, rsgA, rsxG, ruvB, sapD, sdhA, selD, serA, serS, srmB, sthA, sucC, sucD, sufC, tcdA, thiD, thiF, thiI, thiK, thrA, thrB, thrS, torS, trkA, trpS, trxB, tsaE, tsf, tyrA, tyrR, tyrS, uacR, udk, upp, uspF, uvrA, uvrB, valS, wrbA, wzc, xylB, yajQ, ybbA, ybeZ, ybiT, ybjD, ycbZ, ychF, yciA, ydiJ, ydjA, yeeZ, yfbR, ygiC, yjjX, yoaE, zapE, znuC]",,,,,,,,,"[Group11]","[3, 4]","{Group11=2.2386808826529037E-24}","{Group11=3.134153235714065E-23}","GO:0000166",,"nucleotide%20binding","291","GO_MolecularFunction-Custom-GOA-ACAP-ARAP_04.11.2021_00h00","FALSE","false","nucleotide%20binding","nucleotide binding","2.786949937633028E-20","2.07070380366134E-17",,"GO:0000166"
"22.70270347595215",,,"[FAZ83_00115, FAZ83_00420, FAZ83_02015, FAZ83_02925, FAZ83_11150, FAZ83_13460, FAZ83_14160, FAZ83_19765, FAZ83_22845, FAZ83_23645, aceE, ackA, acpS, acpT, adk, aphA, apt, aroK, aroL, bioD, bioD1, bioD2, cca, cheY, citE, cof, cpsG, cysQ, deoB, dgoD, dgt, dhaL, dinB, dmlA, dosP, dut, dxs, eno, entB, entC, entD, fbp, folK, galK, galU, garL, gcd, gcl, glcB, glgC, glmM, glmU, glnE, gmhB, gmm, gph, gpmA, gpt, groL, gshB, gudD, hemB, hipA, hisG, hpt, hslU, hslV, hxpA, hxpB, icd, idi, ilvB, ilvC, ilvG, ilvI, ispD, ispU, kdpB, kdsB, lacZ, leuB, lysS, lysU, manB, menA, menC, menD, menF, metK, mobA, mocA, murC, murE, mutT, nadR, nagD, nfi, nudB, nudC, nudE, nudF, nudI, nudK, nudL, obg, obgE, otsB, oxc, pabB, panB, pckA, pdxA, pdxK, pdxY, pfkA, pfkB, pgm, pheS, pheT, phoA, phoU, pnp, poxB, ppa, ppc, pphB, ppsA, proB, prpB, prs, ptsI, purA, purF, purT, pykA, pykF, pyrE, pyrG, queE, rdgB, recB, rffH, rhmA, rhmD, ribA, ribB, rnc, rne, rnhA, rnt, rpoC, rppH, rusA, ruvC, sbcB, selD, selO, serB, serS, speG, srkA, sucA, sucC, suhB, tatD, thiE, thiF, thiL, thiM, thyA, topB, trmD, trpD, trpGD, tsaD, ttcA, ugpQ, ulaD, upp, valS, vapC, wecA, xni, xylA, ybhA, ybiV, ybjI, ycaO, ycjU, yedP, yegS, ygcB, ygdG, ygjP, yhfW, yidA, yieE, yieH, yigB, yigL, yihX, yqaB, yrfG, yuaH, zntB]","[ackA, adk, aphA, apt, aroK, aroL, bioD1, cysQ, deoB, dhaL, dut, eno, entC, fbp, galK, galU, glgC, glmM, gph, gpmA, gpt, hemB, hipA, hisG, hpt, hslU, hslV, hxpA, icd, idi, ilvI, leuB, lysU, metK, murC, nadR, nagD, nudE, otsB, pckA, pdxA, pdxK, pdxY, pfkA, pfkB, pgm, pheS, pheT, phoA, pnp, poxB, ppa, ppc, proB, prpB, prs, ptsI, purT, pykA, pykF, pyrG, queE, ribA, rnc, rnhA, rnt, rpoC, sbcB, selD, serB, serS, sucC, suhB, thiF, trmD, trpGD, upp, valS, wecA, ybjI, yidA, yigB, yigL, yihX]",,,,,,,,,"[Group00]","[5]","{Group00=3.561690161031745E-8}","{Group00=2.493183112722222E-7}","GO:0000287",,"magnesium%20ion%20binding","84","GO_MolecularFunction-Custom-GOA-ACAP-ARAP_04.11.2021_00h00","TRUE","false","magnesium%20ion%20binding","magnesium ion binding","3.561690161031745E-8","2.4397577603067454E-5",,"GO:0000287"
"27.461139678955078",,,"[FAZ83_00680, FAZ83_04220, FAZ83_05025, FAZ83_05390, FAZ83_06475, FAZ83_08310, FAZ83_10140, FAZ83_21035, FAZ83_22410, FAZ83_23345, FAZ83_25380, FAZ83_25705, accD, acnA, acnB, alaS, arfA, arfB, bglG, bipA, cas5e, casA, casB, casC, casD, casE, cca, chpB, cspA, cspB, cspC, cspD, cspE, cspF, cspG, cspH, cspI, csrA, dbpA, deaD, dtd, dusA, dusB, dusC, efp, epmA, era, ettA, ffh, finO, ftnA, fusA, gltX, greA, greB, hflX, hfq, hicA, higB, hns, hrpA, hslR, hypF, ileS, infA, infB, infC, lasT, lepA, lysS, lysU, mazF, metG, mnmA, nfi, nusA, nusB, obgE, pcnB, pheS, pheT, pnp, prfA, prfB, prfC, prfH, proB, proQ, raiA, rapZ, relE, rhlB, rhlE, rho, rimM, rlmB, rlmD, rlmI, rlmJ, rlmKL, rlmL, rlmN, rluA, rluB, rluC, rluD, rluE, rluF, rmf, rna, rnb, rnc, rne, rng, rnhB, rnpA, rnr, rph, rplA, rplB, rplC, rplD, rplE, rplF, rplI, rplJ, rplK, rplM, rplN, rplO, rplP, rplR, rplS, rplT, rplU, rplV, rplW, rplX, rplY, rpmA, rpmB, rpmC, rpmE, rpmG, rpsA, rpsC, rpsD, rpsE, rpsF, rpsG, rpsH, rpsI, rpsJ, rpsK, rpsL, rpsM, rpsN, rpsO, rpsQ, rpsR, rpsS, rpsT, rpsU, rsgA, rsmA, rsmB, rsmF, rsuA, selB, smpB, speFL, srmB, sspB, stpA, suhB, symE, thiI, thrS, thyA, tmcA, trmA, trmG, trmH, trmJ, trmL, trmO, truA, truB, truC, truD, tsaC, tsf, ttcA, tufA, tufB, typA, tyrS, yafO, yafQ, yajQ, ybcJ, ybiB, yciH, yciO, yeiP, yejK, yfiF, ygcB, ygjH, yhbY, yhgF, yoeB, yuaK]","[accD, acnA, acnB, bipA, cspC, cspE, cspI, csrA, ettA, ffh, ftnA, fusA, gltX, greA, hflX, hfq, hns, infA, infB, infC, lepA, lysU, mnmA, nusA, pcnB, pheS, pheT, pnp, prfA, prfB, prfC, proB, raiA, rapZ, rhlB, rho, rimM, rlmI, rlmJ, rluC, rmf, rna, rnb, rnc, rng, rnr, rplB, rplC, rplD, rplE, rplF, rplI, rplJ, rplK, rplM, rplN, rplO, rplP, rplS, rplT, rplU, rplV, rplW, rplY, rpmA, rpmB, rpmC, rpmE, rpsA, rpsC, rpsD, rpsE, rpsF, rpsG, rpsH, rpsI, rpsJ, rpsK, rpsL, rpsM, rpsN, rpsO, rpsQ, rpsR, rpsS, rpsT, rsgA, rsmB, smpB, srmB, stpA, suhB, thiI, thrS, trmH, trmJ, truA, truB, tsf, tyrS, yajQ, yciH, yciO, yeiP, yfiF, yhgF]",,,,,,,,,"[Group10, Group14, Group16]","[4]","{Group10=2.522363292263363E-20, Group14=1.9697693126353342E-19, Group16=6.427747381108677E-28}","{Group10=3.0268359507160356E-19, Group14=2.1667462438988677E-18, Group16=9.641621071663015E-27}","GO:0003723",,"RNA%20binding","106","GO_MolecularFunction-Custom-GOA-ACAP-ARAP_04.11.2021_00h00","FALSE","false","RNA%20binding","RNA binding","1.1070380343036373E-15","8.114588791445662E-13",,"GO:0003723"
"41.46341323852539",,,"[accD, acnA, acnB, csrA, hicA, proQ, rplM, rplT, rpsA, rpsC, rpsD, rpsF, rpsG, rpsK, rpsO, rpsR, rsmA, selB, thrS, yciH, yhgF]","[accD, acnA, acnB, csrA, rplM, rplT, rpsA, rpsC, rpsD, rpsF, rpsG, rpsK, rpsO, rpsR, thrS, yciH, yhgF]",,,,,,,,,"[Group10]","[5]","{Group10=2.522363292263363E-20}","{Group10=3.0268359507160356E-19}","GO:0003729",,"mRNA%20binding","17","GO_MolecularFunction-Custom-GOA-ACAP-ARAP_04.11.2021_00h00","FALSE","false","mRNA%20binding","mRNA binding","3.888246897046241E-6","0.0025740194458446115",,"GO:0003729"
"21.30777931213379",,,"[FAZ83_00075, FAZ83_00360, FAZ83_01365, FAZ83_02015, FAZ83_02250, FAZ83_02515, FAZ83_02925, FAZ83_03045, FAZ83_03635, FAZ83_05140, FAZ83_05685, FAZ83_05690, FAZ83_05745, FAZ83_05965, FAZ83_06145, FAZ83_06790, FAZ83_07585, FAZ83_08130, FAZ83_08795, FAZ83_09275, FAZ83_09320, FAZ83_09900, FAZ83_09940, FAZ83_10305, FAZ83_10935, FAZ83_11250, FAZ83_11265, FAZ83_12175, FAZ83_12485, FAZ83_14020, FAZ83_14085, FAZ83_14090, FAZ83_15400, FAZ83_15665, FAZ83_15805, FAZ83_15975, FAZ83_16350, FAZ83_16820, FAZ83_16825, FAZ83_16975, FAZ83_17520, FAZ83_18875, FAZ83_19085, FAZ83_19245, FAZ83_19565, FAZ83_19635, FAZ83_19715, FAZ83_20240, FAZ83_20265, FAZ83_20520, FAZ83_20655, FAZ83_21350, FAZ83_21865, FAZ83_22450, FAZ83_23390, FAZ83_23955, FAZ83_24655, FAZ83_24755, FAZ83_25045, FAZ83_25225, aadA1, aas, accA, accC, accD, aceK, ackA, acs, adk, alaS, alsA, alsK, anmK, apbC, aph(3'')-Ib, araB, araG, arcB, arcC, argB, argG, argK, argS, aroK, aroL, artP, asnA, asnB, asnS, aspS, atoC, atoS, atpA, atpC, atpD, atpG, baeS, barA, basS, bax, bcsQ, bioD, bioD1, bioD2, birA, btsS, btuD, btuR, carA, carB, cca, ccmA, cheA, citC, citG, clpA, clpB, clpX, cmk, coaA, coaD, coaE, cobO, cobU, copA, cpxA, creC, cusS, cyaA, cydC, cydD, cysA, cysC, cysD, cysN, cysS, dbpA, dcuS, ddl, ddlA, ddlB, ddpD, ddpF, deaD, dgkA, dgoK, dhaL, dhaR, dinG, dnaA, dnaB, dnaC, dnaJ, dnaK, dnaX, dpiB, dppD, dppF, entE, entF, envZ, epmA, etk, ettA, eutP, eutT, evgS, fadD, fadK, fbpC, fecE, fepC, fetA, fhlA, fhuC, fic, fliI, folC, folK, fre, frlD, fruK, ftsA, ftsE, ftsH, ftsK, fucK, galK, garK, glgC, glk, glnA, glnB, glnE, glnG, glnK, glnL, glnQ, glnS, glpK, glrK, glrR, gltL, gltX, gluQ, gluQRS, glxK, glyQ, glyS, gmk, gntK, gpmA, groES, groL, groS, gshA, gshB, gsiA, gsk, gspA, gspE, gss, guaA, guaB, gutQ, gyrA, gyrB, helD, hflX, hipA, hisG, hisI, hisP, hisS, hldE, hmuV, hofB, hprS, hrpA, hrpB, hscA, hscC, hsdR, hslU, hslV, htpG, hyfR, idnK, ileS, ispE, kdgK, kdpB, kdpC, kdpD, leuS, lhr, livF, livG, lolA, lolD, lon, lplA, lptB, lpxK, lsrA, lysC, lysS, lysU, lyx, macB, mak, malK, malT, mazG, mcrB, mdlA, mdlB, menE, metG, metK, metL, metN, mfd, mglA, mgtA, miaA, minD, mlaF, mnmA, modC, modF, moeB, mog, mpl, mreB, mrp, msbA, mukB, murC, murD, murE, murF, mutL, mutS, nadD, nadE, nadK, nadR, nagK, nanK, narL, narP, narQ, narX, ndk, nikD, nikE, nnr, nnrD, norR, nrdA, nrdD, nrdE, nrdR, ntrB, ntrC, oppD, oppF, otnK, paaK, panC, parC, parE, pat, patZ, pckA, pcnB, pdxK, pdxY, pfkA, pfkB, pgk, pheS, pheT, phnC, phnK, phnL, phnN, phoH, phoQ, phoR, potA, potG, ppk, ppk1, ppsA, ppsR, priA, prkB, proB, proS, proV, prpE, prpR, prs, pspF, pstB, psuK, purC, purD, purK, purL, purM, purT, puuA, pxpA, pxpB, pxpC, pykA, pykF, pyrG, pyrH, qseC, queC, radA, radD, rapA, rapZ, rarA, ravA, rbbA, rbsA, rbsK, rcsC, rcsD, recA, recB, recC, recD, recF, recG, recN, recQ, relA, rep, repE, rfaP, rfaY, rhaB, rhlB, rhlE, rho, ribF, rimK, rnc, rstB, rtcA, rtcR, ruvA, ruvB, sapD, sapF, sbcC, sbmA, secA, selD, selO, serS, sitB, srkA, srmB, ssuB, sucC, sufC, tauB, tcdA, tcyN, tdcD, tdk, thiD, thiF, thiI, thiK, thiL, thiM, thiQ, thrA, thrB, thrS, tilS, tmcA, tmk, torS, traD, traI, trpS, tsaC, tsaE, tssH, ttcA, tyrR, tyrS, uacR, ubiB, udk, udp, ugpC, uhpB, uspF, uup, uvrA, uvrB, uvrD, valS, wzc, xylB, xylG, yadG, yajQ, ybbA, ybdK, ybeZ, ybhF, ybiT, ybjD, ybtP, ybtQ, ycbZ, ychF, ycjV, ycjX, ydaV, ydcT, yddA, yecC, yeeZ, yegD, yegI, yegS, yehL, yehX, yejF, ygcB, ygfA, yggC, yggR, yghR, yghS, yghT, ygiC, yhdZ, yheS, yihV, yjfC, yniA, ynjD, yoaA, yoeF, yojI, ypdA, yphE, yqeC, ytfR, yuaC, yuaR, yubQ, zapE, zntA, znuC, zraR, zraS]","[accD, ackA, acs, adk, alsK, arcB, argG, aroK, aroL, artP, asnB, asnS, aspS, atpA, atpC, atpD, atpG, baeS, barA, bioD1, carA, carB, clpA, clpB, clpX, cmk, coaA, coaE, copA, cpxA, cyaA, cysC, dcuS, ddlA, dgkA, dhaL, dnaA, dnaJ, dnaK, dppD, dppF, entE, entF, etk, ettA, fhuC, fre, fruK, ftsA, ftsE, ftsH, ftsK, galK, glgC, glnA, glnB, glnK, glpK, gltX, glyS, gmk, gpmA, groS, gshA, gsiA, gss, guaA, guaB, gyrA, hflX, hipA, hisG, hisS, hldE, hslU, hslV, ispE, kdgK, leuS, livG, lon, lptB, lysC, lysU, macB, mak, metK, metL, metN, mglA, mgtA, minD, mnmA, modC, mreB, msbA, mukB, murC, murD, murF, mutL, nadE, nadR, nagK, narL, nrdA, nrdE, nrdR, oppD, panC, parC, parE, pckA, pcnB, pdxK, pdxY, pfkA, pfkB, pgk, pheS, pheT, potG, ppk, ppsR, prkB, proB, proS, proV, prs, pstB, purC, purM, purT, pxpB, pykA, pykF, pyrG, pyrH, queC, rapA, rapZ, ravA, rcsD, recA, recF, relA, rhlB, rho, ribF, rnc, ruvB, sapD, selD, serS, srmB, sucC, sufC, tcdA, thiD, thiF, thiI, thiK, thrA, thrB, thrS, torS, trpS, tsaE, tyrR, tyrS, uacR, udk, uspF, uvrA, uvrB, valS, wzc, xylB, yajQ, ybbA, ybeZ, ybiT, ybjD, ycbZ, ychF, yeeZ, ygiC, zapE, znuC]",,,,,,,,,"[Group11]","[5, 6, 7, 8]","{Group11=2.2386808826529037E-24}","{Group11=3.134153235714065E-23}","GO:0005524",,"ATP%20binding","189","GO_MolecularFunction-Custom-GOA-ACAP-ARAP_04.11.2021_00h00","FALSE","false","ATP%20binding","ATP binding","1.542112789976547E-14","1.1211159983129496E-11",,"GO:0005524"
